{
  "lot_number": "LOT-RW-2024-001",
  "timestamp": "2024-03-20T10:30:00Z",
  "creator": {
    "identifier": "COMP-RW-001",
    "name": "Rwanda Mining Corporation Ltd",
    "legal_address": {
      "country": "RW",
      "subnational_division_l1": "RW-01",
      "subnational_division_l1_text": "Kigali City",
      "address_locality": "Kigali"
    },
    "physical_address": {
      "country": "RW",
      "subnational_division_l1": "RW-01",
      "subnational_division_l1_text": "Kigali City",
      "address_locality": "Kigali"
    },
    "tin": "123456789",
    "rdb_number": "RDB-2024-001",
    "rca_number": "RCA-2024-001",
    "contact_details": {
      "legal_representative": "John Doe",
      "contact_phone_number": "+250-788-123-456",
      "contact_email": "contact@rwandamining.rw"
    }
  },
  "mineral": "IMA1960-001",
  "concentration": 45.5,
  "mass": 1000.0,
  "package_type": "bag",
  "unit_of_measurement": "KGM",
  "mine_site_id": "RW-1.9641+30.0619-00001",
  "creator_role": [1],
  "recipient": {
    "identifier": "COMP-RW-002",
    "name": "Rwanda Processing Center",
    "legal_address": {
      "country": "RW",
      "subnational_division_l1": "RW-02",
      "subnational_division_l1_text": "Southern Province",
      "address_locality": "Huye"
    },
    "physical_address": {
      "country": "RW",
      "subnational_division_l1": "RW-02",
      "subnational_division_l1_text": "Southern Province",
      "address_locality": "Huye"
    },
    "tin": "987654321",
    "rdb_number": "RDB-2024-002",
    "rca_number": "RCA-2024-002",
    "contact_details": {
      "legal_representative": "Alice Brown",
      "contact_phone_number": "+250-788-654-321",
      "contact_email": "contact@rwandaprocessing.rw"
    }
  },
  "originating_operation": [1],
  "tag": {
    "identifier": "TAG-RW-2024-001",
    "issuer": {
      "identifier": "GOV-RW-001",
      "name": "Ministry of Mines, Rwanda",
      "legal_address": {
        "country": "RW",
        "subnational_division_l1": "RW-01",
        "subnational_division_l1_text": "Kigali City",
        "address_locality": "Kigali"
      },
      "physical_address": {
        "country": "RW",
        "subnational_division_l1": "RW-01",
        "subnational_division_l1_text": "Kigali City",
        "address_locality": "Kigali"
      },
      "tin": "GOV-001",
      "rdb_number": "GOV-RDB-001",
      "rca_number": "GOV-RCA-001",
      "contact_details": {
        "legal_representative": "Government Representative",
        "contact_phone_number": "+250-788-000-000",
        "contact_email": "mines@gov.rw"
      }
    },
    "issue_date": "2024-03-20",
    "issue_time": "10:30:00"
  },
  "tax_paid": [
    {
      "tax_type": "Mining Royalty",
      "tax_amount": 5000.00,
      "currency": "USD"
    },
    {
      "tax_type": "Export Tax",
      "tax_amount": 2500.00,
      "currency": "USD"
    }
  ],
  "date_sealed": "2024-03-20",
  "date_shipped": "2024-03-22",
  "responsible_staff": "John Doe, Site Manager"
}

